id,title,score,num_comments,author,created_utc,url,over_18,edited,spoiler,stickied
1pj02a0,"22 years old, working 3 jobs, sole earner for my family I’m exhausted and don’t know how to manage anymore",41,12,Complete_Tie_3530,2025-12-10 11:17:39,https://www.reddit.com/r/Nepal/comments/1pj02a0/22_years_old_working_3_jobs_sole_earner_for_my/,False,False,False,False
1pj18e4,Finally left my father after years of verbal abuse and addiction. Did I do the right thing?,34,20,Intelligent-Act-6685,2025-12-10 12:23:02,https://www.reddit.com/r/Nepal/comments/1pj18e4/finally_left_my_father_after_years_of_verbal/,False,False,False,False
1piws4d,Between Pain and Persistence and Still Standing,19,3,CharacterMeaning1666,2025-12-10 07:45:05,https://www.reddit.com/r/Nepal/comments/1piws4d/between_pain_and_persistence_and_still_standing/,False,False,False,False
1pivxuh,Is this something very precious or what?,17,12,NoChoice6739,2025-12-10 06:52:45,https://www.reddit.com/gallery/1pivxuh,False,False,False,False
1piv5ir,Eakkassi butwal ko yaad aayo!,18,10,Striking-Gate-3902,2025-12-10 06:07:11,https://i.redd.it/j63k1a9hib6g1.png,False,False,False,False
1pict01,Queen of Hills - Bandipur : Yet This caught my attention,16,0,Opening_Complaint131,2025-12-09 17:02:14,https://i.redd.it/grfqstmfm76g1.jpeg,False,False,False,False
1piz3vq,Travelling to Nepal tomorrow anyone there?,6,2,Dapper-Attention9451,2025-12-10 10:18:57,https://www.reddit.com/r/Nepal/comments/1piz3vq/travelling_to_nepal_tomorrow_anyone_there/,False,False,False,False
1piqyeq,Hernia Surgery in Kathmandu,5,23,rthapa2580,2025-12-10 02:32:16,https://www.reddit.com/r/Nepal/comments/1piqyeq/hernia_surgery_in_kathmandu/,False,False,False,False
1pifg27,British College Scam for Internship,4,3,fireinthehole12345,2025-12-09 18:43:52,https://www.reddit.com/r/Nepal/comments/1pifg27/british_college_scam_for_internship/,False,False,False,False
1pish8r,Here’s the best possible future for Nepal ( true but lot of u won’t agree),3,20,AdNice3853,2025-12-10 03:45:03,https://www.reddit.com/r/Nepal/comments/1pish8r/heres_the_best_possible_future_for_nepal_true_but/,False,False,False,False
1pj2uzg,Is this job suitable and commendable?,2,4,No-Second-3628,2025-12-10 13:41:45,https://www.reddit.com/r/Nepal/comments/1pj2uzg/is_this_job_suitable_and_commendable/,False,False,False,False
1pj1twb,Passed out 2025 .Should I join BBA or BBS?Am I too late for admission? Avoiding a gap year due to potential abroad study,2,1,iconiczyro,2025-12-10 12:53:41,https://www.reddit.com/r/Nepal/comments/1pj1twb/passed_out_2025_should_i_join_bba_or_bbsam_i_too/,False,False,False,False
1pivoto,"""He was a Friend of Mine""",2,0,itsliterallyme12,2025-12-10 06:38:02,https://www.reddit.com/r/Nepal/comments/1pivoto/he_was_a_friend_of_mine/,False,False,False,False
1pibgfd,Edge Band ko Nova concert ko ticket — kehi info chahiyo,2,1,SubstanceLittle6538,2025-12-09 16:12:11,https://www.reddit.com/r/Nepal/comments/1pibgfd/edge_band_ko_nova_concert_ko_ticket_kehi_info/,False,False,False,False
1pj1oyf,Exploring online business ideas (Budget 1 lakh),1,2,Lost-Spite-4962,2025-12-10 12:46:39,https://www.reddit.com/r/Nepal/comments/1pj1oyf/exploring_online_business_ideas_budget_1_lakh/,False,False,False,False
1pj1e0b,Personal Trainer course in Nepal,1,0,Lonesurvivorpk,2025-12-10 12:31:09,https://www.reddit.com/r/Nepal/comments/1pj1e0b/personal_trainer_course_in_nepal/,False,False,False,False
1pj0q7c,How to Check B.Ed Result 2082 in Nepal?,1,0,Emergency-Cover2253,2025-12-10 11:56:31,https://www.reddit.com/r/Nepal/comments/1pj0q7c/how_to_check_bed_result_2082_in_nepal/,False,False,False,False
1pizvj4,Shops to get Internal SSD for laptop?,1,2,The_Starstriker,2025-12-10 11:06:28,https://www.reddit.com/r/Nepal/comments/1pizvj4/shops_to_get_internal_ssd_for_laptop/,False,False,False,False
1pizskf,Looking for flat to shift immediately in nakhipot area,1,0,Objective-Peach-1167,2025-12-10 11:01:35,https://www.reddit.com/r/Nepal/comments/1pizskf/looking_for_flat_to_shift_immediately_in_nakhipot/,False,False,False,False
1piybgp,Where can I find authentic Yak wool products?,1,0,benc10021,2025-12-10 09:28:15,https://www.reddit.com/r/Nepal/comments/1piybgp/where_can_i_find_authentic_yak_wool_products/,False,False,False,False
1pivisx,"Pet friendly places in Nepal: Kathmandu, Pokhara, Chitwan and Butwal",1,0,Sweaty-Evidence8830,2025-12-10 06:28:43,https://www.reddit.com/r/Nepal/comments/1pivisx/pet_friendly_places_in_nepal_kathmandu_pokhara/,False,False,False,False
1pivblg,India and Nepal :- Deeply connected but emotionally complicated.,2,14,Actual-Historian7729,2025-12-10 06:16:50,https://www.reddit.com/r/Nepal/comments/1pivblg/india_and_nepal_deeply_connected_but_emotionally/,False,False,False,False
1piumae,Home appliances and bathroom items brands & finishing suggestions,1,4,cula123,2025-12-10 05:36:59,https://www.reddit.com/r/Nepal/comments/1piumae/home_appliances_and_bathroom_items_brands/,False,False,False,False
1piu1vx,I am bounded with such situations. I need some recommendations.,1,4,Odd-Individual-7758,2025-12-10 05:05:42,https://www.reddit.com/r/Nepal/comments/1piu1vx/i_am_bounded_with_such_situations_i_need_some/,False,False,False,False
1piz1tt,Need help regarding Faraz.,0,0,Triplefourfourfour,2025-12-10 10:15:24,https://www.reddit.com/r/Nepal/comments/1piz1tt/need_help_regarding_faraz/,False,False,False,False
1piw5oz,i want to sell my laptop macbook air m4 last two month vayo kineko,0,4,Novic_7,2025-12-10 07:05:36,https://www.reddit.com/r/Nepal/comments/1piw5oz/i_want_to_sell_my_laptop_macbook_air_m4_last_two/,False,False,False,False
1piw4pg,"Vitamin D, Vitamin B-12 and what else supplements to take while staying alone in rent?",0,6,PrimaryWaste8717,2025-12-10 07:03:51,https://www.reddit.com/r/Nepal/comments/1piw4pg/vitamin_d_vitamin_b12_and_what_else_supplements/,False,False,False,False
1piubpw,Digital Marketing by Sikumna / Digital saugat,0,3,Useful_Marsupial_960,2025-12-10 05:20:43,https://www.reddit.com/r/Nepal/comments/1piubpw/digital_marketing_by_sikumna_digital_saugat/,False,False,False,False
1pi94g5,Thinking of switching to Google Pixel. Is it worth it? Thinking about going for 9 series. Which one should i go for?,0,6,KiwiAgreeable2738,2025-12-09 14:41:44,https://www.reddit.com/r/Nepal/comments/1pi94g5/thinking_of_switching_to_google_pixel_is_it_worth/,False,False,False,False
1pi91ep,Have anyone worked for a Dreamport?,0,0,disapointed25,2025-12-09 14:38:25,https://www.reddit.com/r/Nepal/comments/1pi91ep/have_anyone_worked_for_a_dreamport/,False,False,False,False
1pit9bk,Edge band ticket needed for NOVA,0,0,Fearless_Injury5974,2025-12-10 04:23:50,https://www.reddit.com/r/Nepal/comments/1pit9bk/edge_band_ticket_needed_for_nova/,False,False,False,False
1pid24x,Need reco: Nepali blogs to follow,0,0,dusklife564,2025-12-09 17:11:25,https://www.reddit.com/r/Nepal/comments/1pid24x/need_reco_nepali_blogs_to_follow/,False,False,False,False
1pic6s5,Want Cheap Second Hand Android Smartphones in Nepal (KTM Valley),0,0,Fun-Collar-2024,2025-12-09 16:39:27,https://www.reddit.com/r/Nepal/comments/1pic6s5/want_cheap_second_hand_android_smartphones_in/,False,False,False,False
1piauut,Organic Jowar/Sorghum Flour in Nepal,0,1,Snoo_42625,2025-12-09 15:49:51,https://www.reddit.com/r/Nepal/comments/1piauut/organic_jowarsorghum_flour_in_nepal/,False,False,False,False
1pipnpg,Best place for guitar exchange,0,1,Practical_Attention4,2025-12-10 01:33:19,https://www.reddit.com/r/Nepal/comments/1pipnpg/best_place_for_guitar_exchange/,False,False,False,False
1pijcy6,Got no help yet so I’m deciding,0,1,Least-Wafer-4437,2025-12-09 21:08:25,https://www.reddit.com/r/Nepal/comments/1pijcy6/got_no_help_yet_so_im_deciding/,False,False,False,False
1pigvhy,MeroShare Feeds shows only 15 SIP credits but I’ve completed 22 — is this normal?,0,7,Impressive-Set6576,2025-12-09 19:35:23,https://www.reddit.com/r/Nepal/comments/1pigvhy/meroshare_feeds_shows_only_15_sip_credits_but_ive/,False,False,False,False
1pie2l6,theres a leopard or cheetah in kirtipur,0,5,barbiegirl743,2025-12-09 17:48:21,https://www.reddit.com/r/Nepal/comments/1pie2l6/theres_a_leopard_or_cheetah_in_kirtipur/,False,False,False,False
1piab0b,Tips to manage massive hair loss,0,2,Imaginary_Map_3146,2025-12-09 15:28:36,https://www.reddit.com/r/Nepal/comments/1piab0b/tips_to_manage_massive_hair_loss/,False,False,False,False
1piw8k0,"Stop using the phrase""Pass out"" for graduation",0,8,ExaminingExistence,2025-12-10 07:10:26,https://www.reddit.com/r/Nepal/comments/1piw8k0/stop_using_the_phrasepass_out_for_graduation/,False,False,False,False
1pihrck,"Itenary for travel, 27 december to 1 jan",0,1,aniketftw,2025-12-09 20:07:47,https://www.reddit.com/r/Nepal/comments/1pihrck/itenary_for_travel_27_december_to_1_jan/,False,False,False,False
1pistib,Planning to Move Back to Nepal — How to Keep My US Investments?,0,1,Single-Leadership167,2025-12-10 04:01:35,https://www.reddit.com/r/Nepal/comments/1pistib/planning_to_move_back_to_nepal_how_to_keep_my_us/,False,False,False,False
1piyry4,must watch if you want to understand nepal's political system in different way; away from populism,0,6,onlyfactos,2025-12-10 09:58:27,https://i.redd.it/up7x915pnc6g1.png,False,False,False,False
